{
  "phase": "8.5",
  "verdict": "PASS",
  "mode": "deep",
  "practitioner_layer": {
    "path": "vault/library/peptides/aod-9604/practitioner-layer.md",
    "present": true,
    "sha256": "ec87d4bcd0e27cae9f51c7c818a53e33dd22940af1ea5419eef8bebef9dc4b4d",
    "compounding_sheets_count": 0,
    "compounding_sheets_or_null_finding": true,
    "named_physicians_count": 1,
    "has_bibliography": true,
    "has_self_check": true
  },
  "non_english_layer": {
    "path": "vault/library/peptides/aod-9604/non-english-layer.md",
    "present": true,
    "sha256": "19ce3b41f6fe392586b5d4643dfa05827a9e58509fa7ada64f074f513c73fac8",
    "languages_surveyed": [
      "Russian",
      "Chinese",
      "Other"
    ],
    "has_bibliography": true,
    "has_self_check": true
  },
  "halt_reasons": [],
  "timestamp": "2026-06-21T02:15:21.727451+00:00",
  "attestation_chain": {
    "iter_start_ts": "2026-06-21T02:14:00.218260+00:00",
    "attest_ts": "2026-06-21T02:15:21.727455+00:00",
    "iteration": 1,
    "agent_source_path": "gates/gate-8.5.md",
    "agent_source_sha256": "69b32d9590e9f9d4cb48030c5ffcc5ed7e16cd248472d102113203b8a17ad765",
    "agent_source_mtime": "2026-06-21T02:15:00.118502+00:00"
  }
}